Branch,Name,USN,Name of the Company/Drive,CTC offered,Provide JAM session details if any,Provide group discussion details if any,Provide Personal Interview/HR Round experience.,Provide the list of Technical/Domain based questions asked during the interview,Provide the list of programming/Domain based (MBA) questions,"Online Exam Pattern
","Important Links for Placement Preparation
","Provide questions on Quantitative Aptitude, Reasoning, and Verbal Ability",Provide the Prominent Section during online test
MBA,Rohit Agarwal,1CR24BA075,HDFC Bank,576000,Na,Na,Na,Na,Na,Na,Na,QA,Quantative Aptitude
MBA,KAVITHA C,1CR24BA046,HDFC,667000,,ETHICS IN BUSINESS,RESUME AND WORK EXPERIENCE BASED QUESTIONS,,,APTITUDE,SOFTSKILLS FROM DEPARTMENT TRAINER,ALL,"Quantative Aptitude, Logical Reasoning, Puzzle Based Questions, Coding MCQs, General Coding"
MBA,Udhay B,1cr24ba113,HDFC,576000,Na,Smart work vs hard work,How would you handle stress and plan your financial life,Na,Aptitude logical reasoning,Aptitude logical reasoning management,,Na,Logical Reasoning
